{
  "id": "biological_sciences_ba",
  "name": "Biological Sciences",
  "kind": "major",
  "degree": "B.A.",
  "catalog_year": "2025-2026",
  "department": "Ecology, Evolution, & Marine Biology; Molecular, Cellular, & Developmental Biology",
  "college": "College of Letters and Science",
  "pre_major_gpa": 2.0,
  "upper_div_units_required": 36,
  "source_pdf": "Biological Sciences BA Major (2025).pdf",
  "notes": "To be admitted to full major status, students must fulfill the pre-biology course and grade-point average requirements as described in the General Catalog and Pre-Biological Sciences Major Sheet. At minimum, they must complete twelve designated courses from the Preparation for the Major with a 2.0 or higher UC grade-point average. Grades earned must meet grade prerequisites for the full major. Hyphens indicate that an entire sequence or combination must be completed as shown to fulfill an area requirement.",
  "groups": [
    {
      "id": "prep_chemistry_general",
      "label": "Preparation for the Major - Chemistry 1A-B-C and 2AL-BL",
      "courses": [
        {
          "id": "CHEM 1A",
          "units": 5
        },
        {
          "id": "CHEM 1B",
          "units": 5
        },
        {
          "id": "CHEM 1C",
          "units": 5
        },
        {
          "id": "CHEM 2AL"
        },
        {
          "id": "CHEM 2BL"
        }
      ],
      "note": "or 1A-AL-B-BL-C-CL or 2A-AC-B-BC-C-CC"
    },
    {
      "id": "prep_biology_core",
      "label": "Preparation for the Major - Biology Core",
      "courses": [
        {
          "id": "MCDB 1A"
        },
        {
          "id": "MCDB 1B"
        },
        {
          "id": "EEMB 2"
        },
        {
          "id": "EEMB 3"
        },
        {
          "id": "MCDB 1LL"
        },
        {
          "id": "EEMB 2LL"
        }
      ]
    },
    {
      "id": "prep_chemistry_organic",
      "label": "Preparation for the Major - Organic Chemistry",
      "courses": [
        {
          "id": "CHEM 6AL"
        },
        {
          "id": "CHEM 109A",
          "alt": [
            "CHEM 109AH"
          ]
        },
        {
          "id": "CHEM 109B",
          "alt": [
            "CHEM 109BH"
          ]
        }
      ]
    },
    {
      "id": "prep_mathematics_calculus",
      "label": "Preparation for the Major - Calculus",
      "courses": [
        {
          "id": "MATH 3A",
          "alt": [
            "MATH 34A"
          ]
        },
        {
          "id": "MATH 3B",
          "alt": [
            "MATH 34B"
          ]
        }
      ]
    },
    {
      "id": "prep_statistics",
      "label": "Preparation for the Major - Statistics",
      "pick": {
        "mode": "choose_n_courses",
        "n_courses": 1
      },
      "courses": [
        {
          "id": "PSTAT 5LS"
        },
        {
          "id": "PSTAT 5A"
        },
        {
          "id": "MATH 4A"
        }
      ]
    },
    {
      "id": "prep_physics",
      "label": "Preparation for the Major - Physics",
      "courses": [
        {
          "id": "PHYS 6A"
        },
        {
          "id": "PHYS 6AL"
        },
        {
          "id": "PHYS 6B"
        },
        {
          "id": "PHYS 6BL"
        }
      ]
    },
    {
      "id": "ud_genetics",
      "label": "A. Genetics",
      "upper_division_required": true,
      "pick": {
        "mode": "choose_n_courses",
        "n_courses": 1
      },
      "note": "MCDB 101B is strongly recommended",
      "courses": [
        {
          "id": "MCDB 101A"
        },
        {
          "id": "EEMB 129"
        }
      ]
    },
    {
      "id": "ud_physiology",
      "label": "B. Physiology",
      "upper_division_required": true,
      "pick": {
        "mode": "choose_n_courses",
        "n_courses": 1
      },
      "courses": [
        {
          "id": "MCDB 111"
        },
        {
          "id": "MCDB 151"
        },
        {
          "id": "EEMB 157A"
        },
        {
          "id": "EEMB 157B"
        },
        {
          "id": "EEMB 157C"
        },
        {
          "id": "EEMB 165"
        }
      ]
    },
    {
      "id": "ud_developmental_cell_biology_biochemistry",
      "label": "C. Developmental and Cell Biology or Biochemistry and Molecular Biology",
      "upper_division_required": true,
      "pick": {
        "mode": "choose_n_courses",
        "n_courses": 1
      },
      "courses": [
        {
          "id": "MCDB 103"
        },
        {
          "id": "MCDB 108A",
          "alt": [
            "MCDB W108A"
          ]
        },
        {
          "id": "MCDB 110"
        },
        {
          "id": "MCDB 112"
        },
        {
          "id": "MCDB 118"
        },
        {
          "id": "MCDB 133"
        },
        {
          "id": "MCDB 134"
        },
        {
          "id": "MCDB 135"
        },
        {
          "id": "MCDB 146"
        },
        {
          "id": "MCDB 151"
        },
        {
          "id": "MCDB 152"
        },
        {
          "id": "MCDB 153"
        }
      ]
    },
    {
      "id": "ud_ecology_evolution",
      "label": "D. Ecology or Evolution",
      "upper_division_required": true,
      "pick": {
        "mode": "choose_n_courses",
        "n_courses": 1
      },
      "courses": [
        {
          "id": "EEMB 101"
        },
        {
          "id": "EEMB 102"
        },
        {
          "id": "EEMB 109",
          "alt": [
            "EARTH 148"
          ]
        },
        {
          "id": "EEMB 113"
        },
        {
          "id": "EEMB 113L"
        },
        {
          "id": "EEMB 119"
        },
        {
          "id": "EEMB 120"
        },
        {
          "id": "EEMB 127"
        },
        {
          "id": "EEMB 128",
          "alt": [
            "ENV S 128"
          ]
        },
        {
          "id": "EEMB 130"
        },
        {
          "id": "EEMB 131",
          "alt": [
            "EARTH 121"
          ]
        },
        {
          "id": "EEMB 136",
          "alt": [
            "EARTH 111"
          ]
        },
        {
          "id": "EEMB 136L",
          "alt": [
            "EARTH 111L"
          ]
        },
        {
          "id": "EEMB 137",
          "alt": [
            "EARTH 141"
          ]
        },
        {
          "id": "EEMB 138"
        },
        {
          "id": "EEMB 140"
        },
        {
          "id": "EEMB 142A"
        },
        {
          "id": "EEMB 147"
        },
        {
          "id": "EEMB 148"
        },
        {
          "id": "EEMB 153"
        },
        {
          "id": "EEMB 155CC"
        },
        {
          "id": "EEMB 158"
        },
        {
          "id": "EEMB 159"
        },
        {
          "id": "EEMB 168"
        },
        {
          "id": "EEMB 171",
          "alt": [
            "ENV S 171"
          ]
        },
        {
          "id": "EEMB 179"
        },
        {
          "id": "EEMB 180"
        }
      ]
    },
    {
      "id": "ud_biodiversity_systematics",
      "label": "E. Biodiversity and Systematics",
      "upper_division_required": true,
      "pick": {
        "mode": "choose_n_courses",
        "n_courses": 1
      },
      "courses": [
        {
          "id": "EEMB 103A"
        },
        {
          "id": "EEMB 106"
        },
        {
          "id": "EEMB 111"
        },
        {
          "id": "EEMB 112"
        },
        {
          "id": "EEMB 113"
        },
        {
          "id": "EEMB 113L"
        },
        {
          "id": "EEMB 116"
        },
        {
          "id": "EEMB 118"
        },
        {
          "id": "EEMB 127"
        },
        {
          "id": "EEMB 133",
          "alt": [
            "ENV S 133"
          ]
        },
        {
          "id": "EEMB 145"
        },
        {
          "id": "EEMB 150A"
        },
        {
          "id": "EEMB 163"
        },
        {
          "id": "MCDB 131"
        },
        {
          "id": "MCDB 139"
        }
      ]
    },
    {
      "id": "ud_electives",
      "label": "F. Electives",
      "upper_division_required": true,
      "note": "Additional UD courses offered in EEMB and MCDB to bring the total to 36 units. The following courses do not count toward upper-division major credit: EEMB 182, 183, 184, 189; MCDB 183, 184, 194D, 194KF, 194MO, 194MP, 194MR. In addition, no more than 4 units of the following courses combined will apply: EEMB 185-199; MCDB 185-199.",
      "courses": []
    }
  ],
  "reviewed": false
}