{
  "id": "pre_financial_mathematics_and_statistics_bs",
  "name": "Pre-Financial Mathematics and Statistics",
  "kind": "major",
  "degree": "B.S.",
  "catalog_year": "2025-2026",
  "department": "Mathematics and Statistics and Applied Probability",
  "college": "College of Letters and Science",
  "pre_major_gpa": 2.5,
  "source_pdf": "Pre-Financial Mathematics & Statistics Major (2025).pdf",
  "reviewed": false,
  "notes": "To be admitted into the full major students must complete all pre-major courses with a 2.5 or higher UC grade point average. All pre-major and preparation for the major courses must be completed with a grade of \"C\" or better. Preparation courses are excluded from the pre-major GPA, but will apply to the overall major GPA. Entry into the pre-major does not guarantee admission to full major status. While completing required preparation, students are classified as pre-majors. Upon satisfactory completion of the pre-major requirements, the student must complete a change of major petition in the Department of Mathematics and obtain the appropriate signatures. At least 2.0 overall UC average in all upper-division major courses and all courses (Prep and UD) for the major. P/NP grading not allowed for major courses. With the approval of each department chairperson, up to a total of 8 units may be applied simultaneously to both UD majors.",
  "groups": [
    {
      "id": "pre_major",
      "label": "PRE-MAJOR",
      "upper_division_required": false,
      "min_grade": "C",
      "courses": [
        {
          "id": "ECON 1",
          "note": "Part of Economics 1 and 2 (10 units total)"
        },
        {
          "id": "ECON 2",
          "note": "Part of Economics 1 and 2 (10 units total)"
        },
        {
          "id": "MATH 2A",
          "alt": [
            "MATH 3A"
          ]
        },
        {
          "id": "MATH 2B",
          "alt": [
            "MATH 3B"
          ]
        },
        {
          "id": "MATH 4A",
          "note": "Either Math 4A, 4B, 6A, or 6B must be completed with a grade of \"B\" or better in order to take Math 8 or PSTAT 8"
        },
        {
          "id": "MATH 4B",
          "note": "Either Math 4A, 4B, 6A, or 6B must be completed with a grade of \"B\" or better in order to take Math 8 or PSTAT 8"
        },
        {
          "id": "MATH 6A",
          "note": "Either Math 4A, 4B, 6A, or 6B must be completed with a grade of \"B\" or better in order to take Math 8 or PSTAT 8"
        },
        {
          "id": "MATH 6B",
          "note": "Either Math 4A, 4B, 6A, or 6B must be completed with a grade of \"B\" or better in order to take Math 8 or PSTAT 8"
        },
        {
          "id": "MATH 8",
          "alt": [
            "PSTAT 8"
          ],
          "note": "Math 8 is a prerequisite for all upper division Math courses except Math 117, 104A, 104B, and 104C. If you plan to take additional upper division Math courses, you must take Math 8"
        }
      ],
      "subgroups": []
    },
    {
      "id": "preparation_for_the_major",
      "label": "PREPARATION FOR THE MAJOR",
      "upper_division_required": false,
      "min_grade": "C",
      "courses": [
        {
          "id": "ECON 10A",
          "units": 5
        },
        {
          "id": "PSTAT 10",
          "units": 5
        }
      ],
      "subgroups": [
        {
          "id": "programming_course",
          "label": "One course from Computer Science or Engineering",
          "pick": {
            "n_courses": 1,
            "mode": "choose_n_courses"
          },
          "upper_division_required": false,
          "min_grade": "C",
          "courses": [
            {
              "id": "CMPSC 8",
              "alt": [
                "CMPSC W8"
              ]
            },
            {
              "id": "CMPSC 9"
            },
            {
              "id": "CMPSC 16"
            },
            {
              "id": "ENGR 3"
            }
          ],
          "subgroups": []
        }
      ]
    }
  ]
}