{
  "id": "french_ba",
  "name": "French",
  "kind": "major",
  "degree": "B.A.",
  "catalog_year": "2025-2026",
  "department": "French & Italian",
  "college": "College of Letters and Science",
  "upper_div_units_required": 40,
  "source_pdf": "FRENCH & ITALIAN DEPARTMENT - FrenchMajor_2025.pdf",
  "reviewed": false,
  "notes": "Native and near-native French speakers are required to consult with the Undergraduate Advisor before enrolling for the first time in any French course in order to verify placement. P/NP grading not allowed for major courses. At least 2.0 overall UC average in all upper-division major courses and all courses (Prep and UD) for the major. With the approval of each department chairperson, up to a total of 8 units may be applied simultaneously to both UD majors.",
  "groups": [
    {
      "id": "preparation",
      "label": "Preparation for the Major",
      "note": "French 16A-B is an accelerated two-quarter sequence that is an option in place of French 1-3.",
      "upper_division_required": false,
      "courses": [
        {
          "id": "FRENCH 1"
        },
        {
          "id": "FRENCH 2"
        },
        {
          "id": "FRENCH 3"
        },
        {
          "id": "FRENCH 4"
        },
        {
          "id": "FRENCH 5"
        },
        {
          "id": "FRENCH 6",
          "alt": [
            "FRENCH 6GS"
          ]
        }
      ],
      "subgroups": []
    },
    {
      "id": "writing_requirement",
      "label": "Writing Requirement",
      "note": "For area A, qualified students can substitute requirements with more advanced courses by petition and instructor's approval.",
      "pick": {
        "n_courses": 2,
        "mode": "choose_n_courses"
      },
      "upper_division_required": true,
      "courses": [
        {
          "id": "FRENCH 104A"
        },
        {
          "id": "FRENCH 104B"
        },
        {
          "id": "FRENCH 104C"
        },
        {
          "id": "FRENCH 104E"
        },
        {
          "id": "FRENCH 104F"
        }
      ],
      "subgroups": []
    },
    {
      "id": "culture_requirement",
      "label": "Culture Requirement",
      "note": "At least one French 104 course is required prior to French 101 courses.",
      "pick": {
        "n_courses": 2,
        "mode": "choose_n_courses"
      },
      "upper_division_required": true,
      "courses": [
        {
          "id": "FRENCH 101A"
        },
        {
          "id": "FRENCH 101B"
        },
        {
          "id": "FRENCH 101C"
        }
      ],
      "subgroups": []
    },
    {
      "id": "upper_division_french",
      "label": "Upper-division courses taught in French",
      "note": "8 units from courses numbered French 105-151, or 197, 198, 199 provided all materials and assignments are completed in French.",
      "pick": {
        "n_units": 8,
        "mode": "choose_n_units"
      },
      "upper_division_required": true,
      "courses": [
        {
          "id": "FRENCH 105",
          "note": "courses numbered 105-151"
        },
        {
          "id": "FRENCH 197"
        },
        {
          "id": "FRENCH 198"
        },
        {
          "id": "FRENCH 199"
        }
      ],
      "subgroups": []
    },
    {
      "id": "additional_electives",
      "label": "Additional upper-division electives",
      "note": "14 units of electives from courses numbered French 105-199, with or without 191F, or from the following courses. By petition up to 8 units from Comparative Literature can be applied to the upper-division major provided the course is taught by the faculty from the French and Italian Department.",
      "pick": {
        "n_units": 14,
        "mode": "choose_n_units"
      },
      "upper_division_required": true,
      "courses": [
        {
          "id": "FRENCH 105",
          "note": "courses numbered 105-199"
        },
        {
          "id": "FRENCH 191F"
        },
        {
          "id": "HIST 121C"
        },
        {
          "id": "HIST 121F"
        },
        {
          "id": "HIST 127A"
        },
        {
          "id": "HIST 127F"
        },
        {
          "id": "HIST 137A"
        },
        {
          "id": "HIST 137B"
        },
        {
          "id": "ARTHI 142B"
        },
        {
          "id": "ARTHI 142C"
        },
        {
          "id": "ARTHI 142E"
        },
        {
          "id": "SOC 185F"
        }
      ],
      "subgroups": []
    }
  ]
}